Chipset Configuration Registers
965 page 265

coreboot-4.0-6827-gfd1e162 Sat  9 May 09:38:39 CEST 2015 starting...
running main(bist = 0)
0x0000: 0x10010002
0x0004: 0x00000801
0x0008: 0x00000001
0x000c: 0x00000000
0x0010: 0x00000001
0x0014: 0x800000ff
0x0018: 0x00000000
0x001c: 0x03008010
0x0080: 0x00000000
0x0084: 0x00000000
0x0088: 0x00000000
0x008c: 0x00002000
0x0090: 0x00002000
0x0094: 0x00000000
0x0098: 0x00000000
0x009c: 0x00000000
0x00f0: 0x00000000
0x00f4: 0x00000000
0x00f8: 0x00000000
0x00fc: 0x1a010005
0x0100: 0x00000802
0x0104: 0x00000000
0x0108: 0x00000000
0x010c: 0x00000001
0x0110: 0x00000000
0x0114: 0x00000000
0x0118: 0x00000000
0x011c: 0x01000003
0x0120: 0x00000000
0x0124: 0x000e0000
0x0128: 0x00000000
0x012c: 0x02000003
0x0130: 0x00000000
0x0134: 0x000e1000
0x0138: 0x00000000
0x013c: 0x03000003
0x0140: 0x00000000
0x0144: 0x000e2000
0x0148: 0x00000000
0x014c: 0x04000003
0x0150: 0x00000000
0x0154: 0x000e3000
0x0158: 0x00000000
0x015c: 0x0f000003
0x0160: 0x00000000
0x0164: 0x000d8000
0x0168: 0x00000000
0x016c: 0x05000003
0x0170: 0x00000000
0x0174: 0x000e4000
0x0178: 0x00000000
0x017c: 0x06000003
0x0180: 0x00000000
0x0184: 0x000e5000
0x0188: 0x00000000
0x018c: 0x00000000
0x0190: 0x00000000
0x0194: 0x00000000
0x0198: 0x00000000
0x019c: 0x00010006
0x01a0: 0x00012441
0x01a4: 0x00410000
0x01a8: 0x00000000
0x01ac: 0x00000000
0x01e0: 0x00000000
0x01e4: 0x00000000
0x01e8: 0x00000000
0x01ec: 0x00000001
0x01f0: 0x00000000
0x01f4: 0x00000000
0x01f8: 0x00000000
0x01fc: 0x01102008
0x0200: 0x00000000
0x0204: 0x04210044
0x0208: 0x00000000
0x020c: 0x0000f710
0x0210: 0x00000000
0x0214: 0x00000000
0x0218: 0x00000000
0x021c: 0x14128aaa
0x0220: 0x00000000
0x0224: 0x00010000
0x0228: 0x00000000
0x022c: 0x00543210
0x0230: 0x00000000
0x0234: 0x00010000
0x0238: 0x00070018
0x023c: 0x00040009
0x0240: 0x00000000
0x0244: 0x00060000
0x0248: 0x00880676
0x024c: 0x0037015b
0x0250: 0x00000000
0x0254: 0x00080020
0x0258: 0x00000000
0x025c: 0x00070018
0x0260: 0x00000000
0x0264: 0x00060000
0x0268: 0x00040010
0x026c: 0x00000000
0x0270: 0x00240008
0x0274: 0x00000000
0x0278: 0x00000000
0x027c: 0x00040008
0x0f10: 0x00000000
0x0f14: 0x00000000
0x0f18: 0x00000000
0x0f1c: 0xb2b477cc
0x0f20: 0x000000c3
0x0f24: 0x001ff800
0x0f28: 0x00100fff
0x0f2c: 0x00000781
0x1d30: 0x00000000
0x1d34: 0x00000000
0x1d38: 0x00000000
0x1d3c: 0x000000b1
0x1d40: 0x00000000
0x1d44: 0x00000000
0x1d48: 0x00030000
0x1d4c: 0x00000000
0x2000: 0x00000000
0x2004: 0x00000000
0x2008: 0x00000000
0x200c: 0x14000016
0x2010: 0xbc4abcb5
0x2014: 0x00000000
0x2018: 0x00c9605b
0x201c: 0x0b303080
0x2020: 0x0038fcfa
0x2024: 0x0fac0fa9
0x2028: 0x00004414
0x202c: 0xb2b477cc
0x2030: 0x00000000
0x2034: 0x00000000
0x2038: 0x00000000
0x203c: 0x000000c3
0x2040: 0x00000000
0x2044: 0x001ff800
0x2048: 0x001007ff
0x204c: 0x00000787
0x2050: 0x00000000
0x2054: 0x00000000
0x2058: 0x81000000
0x205c: 0x00000000
0x2070: 0x00000000
0x2074: 0x00000000
0x2078: 0x00000000
0x207c: 0x18006006
0x2080: 0x00000000
0x2084: 0x00000260
0x2088: 0x0006000c
0x208c: 0x32000000
0x2090: 0x00000000
0x2094: 0x00000000
0x2098: 0x00000000
0x209c: 0x18006006
0x20a0: 0x00000000
0x20a4: 0x00000260
0x20a8: 0x0006000c
0x20ac: 0x03000000
0x20b0: 0x00000000
0x20b4: 0x00000000
0x20b8: 0x00000000
0x20bc: 0x18006006
0x20c0: 0x00000000
0x20c4: 0x00000260
0x20c8: 0x0006000c
0x20cc: 0x09000000
0x20d0: 0x00000000
0x20d4: 0x00000000
0x20d8: 0x00000000
0x20dc: 0x18006006
0x20e0: 0x00000000
0x20e4: 0x00000260
0x20e8: 0x0006000c
0x20ec: 0x38000000
0x3010: 0x00000000
0x3014: 0x00000000
0x3018: 0x00000000
0x301c: 0x00001fff
0x3020: 0x00002000
0x3024: 0x00000000
0x3028: 0x00000000
0x302c: 0x00000000
0x3060: 0x00000000
0x3064: 0x00000000
0x3068: 0x00000000
0x306c: 0x00000202
0x3070: 0x00001fff
0x3074: 0x00001fff
0x3078: 0x00001fff
0x307c: 0x00001fff
0x30c0: 0x00000000
0x30c4: 0x00000000
0x30c8: 0x00000000
0x30cc: 0xffffffff
0x30f0: 0x00000000
0x30f4: 0x00000000
0x30f8: 0x00000000
0x30fc: 0x03243210
0x3100: 0x00000000
0x3104: 0x10004321
0x3108: 0x00214321
0x310c: 0x00000001
0x3110: 0x30000021
0x3114: 0x00000001
0x3118: 0x00000000
0x311c: 0x00000000
0x3130: 0x00000000
0x3134: 0x00000000
0x3138: 0x00000000
0x313c: 0x00003210
0x3140: 0x32103210
0x3144: 0x00003210
0x3148: 0x00003210
0x314c: 0x00003210
0x33f0: 0x00000000
0x33f4: 0x00000000
0x33f8: 0x00000000
0x33fc: 0x00000004
0x3400: 0x00000000
0x3404: 0x00000000
0x3408: 0x00000000
0x340c: 0x00080404
0x34f0: 0x00000000
0x34f4: 0x00000000
0x34f8: 0x00000000
0x34fc: 0x03ff03ff
0x3500: 0x1b6db6db
0x3504: 0x00000000
0x3508: 0x00000020
0x350c: 0x09008fb8
0x3510: 0x00000000
0x3514: 0x00000000
0x3518: 0x00000000
0x351c: 0x16007f80
0x3520: 0x0000c008
0x3524: 0x1800ff4f
0x3528: 0x00000000
0x352c: 0x00000000
0x3df0: 0x00000000
0x3df4: 0x00000000
0x3df8: 0x00000000
0x3dfc: 0xffffffff
0x3e00: 0xffffffff
0x3e04: 0xffffffff
0x3e08: 0xffffffff
0x3e0c: 0xffffffff
0x3e10: 0xffffffff
0x3e14: 0xffffffff
0x3e18: 0xffffffff
0x3e1c: 0xffffffff
0x3e20: 0xffffffff
0x3e24: 0xffffffff
0x3e28: 0xffffffff
0x3e2c: 0xffffffff
0x3e30: 0xffffffff
0x3e34: 0xffffffff
0x3e38: 0xffffffff
0x3e3c: 0xffffffff
0x3e40: 0xffffffff
0x3e44: 0xffffffff
0x3e48: 0xffffffff
0x3e4c: 0xffffffff
0x3e50: 0xffffffff
0x3e54: 0xffffffff
0x3e58: 0xffffffff
0x3e5c: 0xffffffff
0x3e60: 0xffffffff
0x3e64: 0xffffffff
0x3e68: 0xffffffff
0x3e6c: 0xffffffff
0x3e70: 0xffffffff
0x3e74: 0xffffffff
0x3e78: 0xffffffff
0x3e7c: 0x00000000
0x3ef0: 0x00000000
0x3ef4: 0x00000000
0x3ef8: 0x00000000
0x3efc: 0x0000000b
0x3ff0: 0x00000000
0x3ff4: 0x00000000
0x3ff8: 0x00000000
0x3ffc: 0xffffffff
