CPU: ID 0x6fb, Processor Type 0x0, Family 0x6, Model 0xf, Stepping 0xb
Northbridge: 8086:2a00 (965PM)
Southbridge: 8086:2811 (ICH8M-E)

============= RCBA ==============

RCBA = 0xfed1c000 (MEM)

0x0000: 0x10010002
0x0004: 0x00000801
0x0008: 0x00000001
0x0010: 0x00000001
0x0014: 0x80000001
0x001c: 0x03128010
0x0020: 0x81080080
0x0030: 0x0000000f
0x0034: 0x000f0000
0x003c: 0x000000f0
0x0040: 0x0f000000
0x0048: 0x0000f000
0x0050: 0x0000000f
0x0054: 0x000f0000
0x005c: 0x000000f0
0x0060: 0x0f000000
0x0068: 0x0000f000
0x0088: 0x00109000
0x0090: 0x00002000
0x0094: 0x00002000
0x0100: 0x1a010005
0x0104: 0x00020802
0x0110: 0x01010001
0x0118: 0xfed18000
0x0120: 0x01020003
0x0128: 0x000e0000
0x0130: 0x02020003
0x0138: 0x000e1000
0x0140: 0x03020002
0x0148: 0x000e2000
0x0150: 0x04020002
0x0158: 0x000e3000
0x0160: 0x0f020003
0x0168: 0x000d8000
0x0170: 0x05020002
0x0178: 0x000e4000
0x0180: 0x06020002
0x0188: 0x000e5000
0x01a0: 0x00010006
0x01a4: 0x00012c41
0x01a8: 0x00410003
0x01f0: 0x00000001
0x01f4: 0x86000040
0x01fc: 0x0000060b
0x0200: 0x01102008
0x0208: 0x04210044
0x0210: 0x0000f710
0x0220: 0x00000045
0x0228: 0x14128aaa
0x0230: 0x00010000
0x0234: 0x00000003
0x0238: 0x00543210
0x0240: 0x001002cf
0x0244: 0x001602e7
0x0248: 0x00d0065b
0x024c: 0x00840000
0x0250: 0x008a0000
0x0254: 0x00840dc7
0x0258: 0x0084021e
0x0260: 0x00270368
0x0268: 0x00030018
0x0270: 0x00030000
0x0274: 0x00040010
0x0278: 0x00b808cf
0x027c: 0x00bc08df
0x0280: 0x00580000
0x0284: 0x005e0000
0x0288: 0x0066059e
0x0f20: 0xb2b577cc
0x0f24: 0x000000c3
0x0f28: 0x00180000
0x0f2c: 0x001fffff
0x0f30: 0x0000ff8f
0x1d3c: 0x0000000a
0x1d40: 0x00000001
0x1d48: 0x00030000
0x1e98: 0x000c0801
0x1e9c: 0x000200f0
0x2010: 0x00080000
0x2014: 0x14000016
0x2018: 0xbc4abcb5
0x2020: 0x00c9605b
0x2024: 0x0d303000
0x2028: 0x0048f459
0x202c: 0x0db90459
0x2030: 0x00004414
0x2034: 0xb2b577cc
0x2044: 0x000000c3
0x204c: 0x001ff000
0x2050: 0x00100fff
0x2054: 0x000003ff
0x2060: 0x81000000
0x2080: 0x18006006
0x2088: 0x00000260
0x208c: 0x0006000c
0x2090: 0x0b000000
0x20a0: 0x18006006
0x20a8: 0x00000260
0x20ac: 0x0006000c
0x20b0: 0x38000000
0x20c0: 0x18006006
0x20c8: 0x00000260
0x20cc: 0x0006000c
0x20d0: 0x02000000
0x20e0: 0x18006006
0x20e8: 0x00000260
0x20ec: 0x0006000c
0x20f0: 0x30000000
0x3020: 0x03ff0280
0x3024: 0x3f04e008
0x3070: 0x00000a0b
0x3078: 0x03ff0280
0x307c: 0x027d0001
0x3080: 0x027f027e
0x3094: 0x9fff03f0
0x30b0: 0x00400000
0x30b4: 0x143b5006
0x30b8: 0x05200302
0x30bc: 0x0001209f
0x30d0: 0x00004000
0x30d4: 0x00186484
0x30e0: 0x00200507
0x3100: 0x00001230
0x3108: 0x40000321
0x310c: 0x00014321
0x3110: 0x00000002
0x3114: 0x30000021
0x3118: 0x00000001
0x3140: 0x00000007
0x3144: 0x76543210
0x3148: 0x00000010
0x314c: 0x00000654
0x3150: 0x00000004
0x31fc: 0x03000000
0x3400: 0x0000001c
0x3404: 0x00000080
0x3410: 0x00240460
0x3418: 0x033c0401
0x341c: 0xff4f801f
0x3430: 0x00000001
0x3500: 0x03ff03ff
0x3504: 0x1b6db6db
0x350c: 0x08000020
0x3510: 0x09008fb8
0x3528: 0x17001fbf
0x352c: 0x0002c008
0x3530: 0x1800ff4f
0x3e00: 0xffffffff
0x3e04: 0xffffffff
0x3e08: 0xffffffff
0x3e0c: 0xffffffff
0x3e10: 0xffffffff
0x3e14: 0xffffffff
0x3e18: 0xffffffff
0x3e1c: 0xffffffff
0x3e20: 0xffffffff
0x3e24: 0xffffffff
0x3e28: 0xffffffff
0x3e2c: 0xffffffff
0x3e30: 0xffffffff
0x3e34: 0xffffffff
0x3e38: 0xffffffff
0x3e3c: 0xffffffff
0x3e40: 0xffffffff
0x3e44: 0xffffffff
0x3e48: 0xffffffff
0x3e4c: 0xffffffff
0x3e50: 0xffffffff
0x3e54: 0xffffffff
0x3e58: 0xffffffff
0x3e5c: 0xffffffff
0x3e60: 0xffffffff
0x3e64: 0xffffffff
0x3e68: 0xffffffff
0x3e6c: 0xffffffff
0x3e70: 0xffffffff
0x3e74: 0xffffffff
0x3e78: 0xffffffff
0x3e7c: 0xffffffff
0x3f00: 0x0000000b


